"Name","Subject","Message","Date","Phone Number","Country","Attachments"
"Me","","Hey Veronica, it's Andrew. Nice to meet ya. Sounds like your next week is bananas, but if you're free tonight, some friends and I will be out near you.","Jan 8, 2016, 2:45:59 PM","+19172916788","",""
"Me","","And I'd really like it if you joined us for a drink. ","Jan 8, 2016, 2:46:20 PM","+19172916788","",""
"1 (917) 291-6788","","So sweet! Would love to but I have a friend coming into town and we're hanging out near Fillmore area","Jan 8, 2016, 2:59:11 PM","+19172916788","",""
"1 (917) 291-6788","","We'll be playing it by ear though","Jan 8, 2016, 2:59:33 PM","+19172916788","",""
"Me","","Oh rad. I can't fault you for hanging with old pals or hanging around the filmore! I'll let you know our plan, and we'll see what happens :)","Jan 8, 2016, 3:04:35 PM","+19172916788","",""
"Me","","The plan ended up being: eat lots of prime rib, have two drinks, end up in bed by midnight. Pretty intense. How was your evening?","Jan 9, 2016, 10:34:42 AM","+19172916788","",""
"Me","","Hey! When are you back from Mormon Town?","Jan 14, 2016, 11:32:30 AM","+19172916788","",""
"1 (917) 291-6788","","Sunday! ","Jan 14, 2016, 11:51:33 AM","+19172916788","",""
"Me","","Oh yeah? I leave Sunday night. Maybe we can squeeze in a park adventure in the afternoon. What time are you in?","Jan 14, 2016, 1:03:30 PM","+19172916788","",""
