"Name","Subject","Message","Date","Phone Number","Country","Attachments"
"1 (902) 817-0539","","Andrew?","Dec 18, 2014, 8:03:58 AM","+19028170539","",""
"Me","","That's me! Who's this?","Dec 18, 2014, 8:05:45 AM","+19028170539","",""
"1 (902) 817-0539","","You should always keep old contacts in your phone - never know when one has a business idea and thinks you're the person to talk to (maybe after Mars)","Dec 18, 2014, 8:08:32 AM","+19028170539","",""
"1 (902) 817-0539","","Jon","Dec 18, 2014, 8:08:32 AM","+19028170539","",""
"1 (902) 817-0539","","How is Strings going?","Dec 18, 2014, 9:01:52 AM","+19028170539","",""
"Me","","Hah, I'd assumed you'd gotten a 647 number! Strings is going ok, trying to figure out the next steps. It's pretty tough. ","Dec 18, 2014, 10:54:43 PM","+19028170539","",""
"Me","","A business idea eh?","Dec 18, 2014, 10:54:49 PM","+19028170539","",""
