"Name","Subject","Message","Date","Phone Number","Country","Attachments"
"Me","","I miss you bud. Hanging with jazz. Come to Toronto!","Sep 11, 2014, 8:58:59 PM","+19025793626","",""
"Dan ","","Haha who is this?","Sep 12, 2014, 7:07:46 AM","+19025793626","",""
"Me","","Andrew Konoff! Forgot I changed my number hah","Sep 12, 2014, 7:08:05 AM","+19025793626","",""
"Dan ","","Haha. I miss you too, but I hate Toronto! :-P","Sep 12, 2014, 7:08:56 AM","+19025793626","",""
"Me","","Lollll. Well hopefully I'll be in Halifax this fall, thereby avoiding that problem","Sep 12, 2014, 7:10:57 AM","+19025793626","",""
