"Name","Subject","Message","Date","Phone Number","Country","Attachments"
"1 (650) 206-2402","","Dawson via Hop: Friday drinks at Wvrst . Group chat: http://hopapp.co/xvbi","May 26, 2015, 12:31:23 PM","+16502062402","",""
"1 (650) 206-2402","","Dawson via Hop: Drinks downtown. Group chat: http://hopapp.co/evqb","May 29, 2015, 4:08:32 PM","+16502062402","",""
"1 (650) 206-2402","","Dawson via Hop: Drinks downtown. Group chat: http://hopapp.co/evqb","May 29, 2015, 4:49:41 PM","+16502062402","",""
"Me","","Stop","Jun 1, 2015, 10:12:22 AM","+16502062402","",""
"1 (650) 206-2402","","You have successfully been unsubscribed. You will not receive any more messages from this number.","Jun 1, 2015, 10:12:24 AM","+16502062402","",""
