"Name","Subject","Message","Date","Phone Number","Country","Attachments"
"Zach Aysan ","","Hey man! The polish community centre ","Oct 16, 2014, 8:53:36 AM","zachaysan@gmail.com","",""
"Me","","Awesome. This is gonna get turned up :D","Oct 16, 2014, 9:44:13 AM","zachaysan@gmail.com","",""
"Me","","Lol is the game really that painful?","Dec 10, 2014, 8:34:08 PM","zachaysan@gmail.com","",""
"Zach Aysan ","","Yes. ","Dec 11, 2014, 1:58:30 AM","zachaysan@gmail.com","",""
"Zach Aysan ","","It's so long and it railroads you into playing a certain way ","Dec 11, 2014, 1:59:04 AM","zachaysan@gmail.com","",""
"Me","","Rough. I guess I'll have to pack extra liquor. Btw, what are you up to saturday night?","Dec 11, 2014, 8:48:32 AM","zachaysan@gmail.com","",""
"Zach Aysan ","","At a Christmas dinner thing","Dec 11, 2014, 8:51:12 AM","zachaysan@gmail.com","",""
"Me","","Ahh zak's? If it ends early, you guys should roll to my place. having a shaker, starting later in the evening","Dec 11, 2014, 11:18:47 AM","zachaysan@gmail.com","",""
"Zach Aysan ","","Haha, sounds good man","Dec 11, 2014, 3:06:40 PM","zachaysan@gmail.com","",""
