"Name","Subject","Message","Date","Phone Number","Country","Attachments"
"32665101","","Katelyn Slyer commented on your photo.
https://fb.com/l/1Owc66TjYhK0TEH 
awww!

Reply with your comment or ""like"".
Std SMS and data rates may apply.","Nov 24, 2015, 6:58:16 PM","32665101","",""
"32665101","","Joyce Konoff commented on your photo.
https://fb.com/l/1OtBeqD3ZMLxMyC 
Man and his dog... Super photo Andrew

Reply with your comment or ""like"".
Std SMS and data rates may apply.","Nov 24, 2015, 7:04:23 PM","32665101","",""
